<?xml version="1.0" encoding="UTF-8"?>
<!DOCTYPE company SYSTEM "05.dtd" >
<company xmlns:xsi="http://www.w3.org/2001/XMLSchema-instance" xsi:noNamespaceSchemaLocation="05.xsd">
    <employee>
        <FirstName>Juan</FirstName>
        <LastName>Sanchez</LastName>
        <ContacNo>123456789</ContacNo>
        <Email>juansanchez@company.com</Email>
        <Address>
            <City>Bangalore</City>
            <State>Karnataka</State>
            <Zip>560212</Zip>
        </Address>
    </employee>
</company>
